{
  "contractVersion": "1.4.0",
  "executionReceipt": {
    "path": "tools/standards/evidence/recovery-tabletop-execution.v1.json",
    "sha256": "88629ac0c10aba32032c9d140f4910123f9b705fa6ee62c86e0545f608415336",
    "sourceClosureSha256": "72e4c90a22b876414678bd1d5c6d73669045daedee04f1a6cc1a225d2f014158"
  },
  "findings": [
    {
      "foundAt": "2026-08-09T19:20:00Z",
      "id": "H13-001",
      "owner": "jakub-niezgoda",
      "resolution": "Version 1.1 binds a closed source inventory, toolchain, normalized execution result, package inventory, findings, and sole-maintainer review; every substitution now fails replay.",
      "resolvedAt": "2026-08-09T19:39:05Z",
      "severity": "P1",
      "status": "resolved",
      "summary": "The first H13 record asserted completion without binding exact executed evidence or accountable review.",
      "targetDate": "2026-08-09",
      "targetMilestone": "G5"
    },
    {
      "foundAt": "2026-08-09T19:20:00Z",
      "id": "H13-002",
      "owner": "jakub-niezgoda",
      "resolution": "Each inject, expectation, observation, outcome, and complete ordered normative action list is now exact and independently mutation-tested.",
      "resolvedAt": "2026-08-09T19:39:05Z",
      "severity": "P1",
      "status": "resolved",
      "summary": "The first validator did not independently require every shutdown, quarantine, rotation, verification, advisory, and preservation action.",
      "targetDate": "2026-08-09",
      "targetMilestone": "G5"
    },
    {
      "foundAt": "2026-08-09T19:20:00Z",
      "id": "H13-003",
      "owner": "jakub-niezgoda",
      "resolution": "Schema validity, evidence validity, and release acceptance are now separate outputs, and the stacked A05/H13 ledger records both completed commits and the correct total.",
      "resolvedAt": "2026-08-09T19:39:05Z",
      "severity": "P2",
      "status": "resolved",
      "summary": "The first implementation conflated schema validity with acceptance and left the inherited A05 status/count stale.",
      "targetDate": "2026-08-09",
      "targetMilestone": "G5"
    },
    {
      "foundAt": "2026-08-09T19:45:00Z",
      "id": "H13-004",
      "owner": "jakub-niezgoda",
      "resolution": "The capture command now derives canonical individual test outcomes, command exits, real package inventories, and actual tool versions from executed processes.",
      "resolvedAt": "2026-08-09T19:59:30Z",
      "severity": "P1",
      "status": "resolved",
      "summary": "The version 1.1 receipt hashed maintainer-declared counts instead of generated command outcomes.",
      "targetDate": "2026-08-09",
      "targetMilestone": "G5"
    },
    {
      "foundAt": "2026-08-09T19:45:00Z",
      "id": "H13-005",
      "owner": "jakub-niezgoda",
      "resolution": "Capture now hashes every tracked working-tree path and byte with three explicit self-reference exclusions and requires zero other untracked files.",
      "resolvedAt": "2026-08-09T19:59:30Z",
      "severity": "P1",
      "status": "resolved",
      "summary": "The version 1.1 seven-file source inventory omitted transitive test, build, package, schema, manifest, and documentation inputs.",
      "targetDate": "2026-08-09",
      "targetMilestone": "G5"
    },
    {
      "foundAt": "2026-08-09T19:45:00Z",
      "id": "H13-006",
      "owner": "jakub-niezgoda",
      "resolution": "Findings now require severity, summary, owner, target milestone/date, lifecycle state, and consistent resolution chronology; valid open findings prevent acceptance.",
      "resolvedAt": "2026-08-09T19:59:30Z",
      "severity": "P1",
      "status": "resolved",
      "summary": "The version 1.1 finding model could not honestly represent structured open findings and their ownership or due dates.",
      "targetDate": "2026-08-09",
      "targetMilestone": "G5"
    },
    {
      "foundAt": "2026-08-09T19:45:00Z",
      "id": "H13-007",
      "owner": "jakub-niezgoda",
      "resolution": "Replay compares the current toolchain to the captured versions and explicitly reports current-replay or historical-attestation.",
      "resolvedAt": "2026-08-09T19:59:30Z",
      "severity": "P2",
      "status": "resolved",
      "summary": "The version 1.1 verifier did not distinguish a matching current runtime from validation of a historical execution.",
      "targetDate": "2026-08-09",
      "targetMilestone": "G5"
    },
    {
      "foundAt": "2026-08-09T20:20:00Z",
      "id": "H13-008",
      "owner": "jakub-niezgoda",
      "resolution": "Capture now requires identical bounded HEAD, index, tracked, untracked, inventory, and working-byte closures before and after every exercised command, with explicit mutation-during-run tests.",
      "resolvedAt": "2026-08-09T20:48:55Z",
      "severity": "P1",
      "status": "resolved",
      "summary": "The version 1.2 receipt did not prove that the exercised source remained immutable for the complete command interval.",
      "targetDate": "2026-08-09",
      "targetMilestone": "G5"
    },
    {
      "foundAt": "2026-08-09T20:20:00Z",
      "id": "H13-009",
      "owner": "jakub-niezgoda",
      "resolution": "The sole-maintainer review-subject digest now covers the receipt and source bindings, every scenario and finding field, the complete review metadata, and the release decision, with capture and resolution chronology enforced.",
      "resolvedAt": "2026-08-09T20:48:55Z",
      "severity": "P1",
      "status": "resolved",
      "summary": "The version 1.2 review digest covered only the review object and allowed findings, scenarios, or release acceptance to change outside the accountable review subject.",
      "targetDate": "2026-08-09",
      "targetMilestone": "G5"
    },
    {
      "foundAt": "2026-08-09T20:20:00Z",
      "id": "H13-010",
      "owner": "jakub-niezgoda",
      "resolution": "Every capture and probe subprocess now has explicit time and output bounds, normalized status, signal, timeout, and duration evidence, forced termination, an overall deadline, and finally-block cleanup.",
      "resolvedAt": "2026-08-09T20:48:55Z",
      "severity": "P1",
      "status": "resolved",
      "summary": "The version 1.2 subprocesses could hang indefinitely and did not bind termination or timeout state.",
      "targetDate": "2026-08-09",
      "targetMilestone": "G5"
    },
    {
      "foundAt": "2026-08-09T20:20:00Z",
      "id": "H13-011",
      "owner": "jakub-niezgoda",
      "resolution": "Capture validates the declared pnpm@11.18.0 version against a resolved executable identity and binds both pnpm and Node executable digests; unavailable bounded current probes are reported as historical attestation rather than hanging replay.",
      "resolvedAt": "2026-08-09T20:48:55Z",
      "severity": "P2",
      "status": "resolved",
      "summary": "The version 1.2 runtime probe used an unbounded ambient pnpm lookup without binding its exact execution context.",
      "targetDate": "2026-08-09",
      "targetMilestone": "G5"
    },
    {
      "foundAt": "2026-08-09T20:20:00Z",
      "id": "H13-012",
      "owner": "jakub-niezgoda",
      "resolution": "Closure collection now bounds Git output, file count, individual and aggregate bytes; sanitizes Git repository/config/index/object environment; rejects hard links; rechecks directory ancestry; and requires the exact four unique package identities.",
      "resolvedAt": "2026-08-09T20:48:55Z",
      "severity": "P1",
      "status": "resolved",
      "summary": "The version 1.2 closure and package parser lacked complete resource, hard-link, Git-environment, ancestry, and uniqueness controls.",
      "targetDate": "2026-08-09",
      "targetMilestone": "G5"
    },
    {
      "foundAt": "2026-08-09T20:55:00Z",
      "id": "H13-013",
      "owner": "jakub-niezgoda",
      "resolution": "The asynchronous runner creates an isolated process group, kills the complete descendant tree on timeout, and bounds post-kill cleanup; a real grandchild write-after-timeout test proves containment.",
      "resolvedAt": "2026-08-09T21:19:55Z",
      "severity": "P1",
      "status": "resolved",
      "summary": "The version 1.3 timeout killed only the direct child and could leave descendants running.",
      "targetDate": "2026-08-09",
      "targetMilestone": "G5"
    },
    {
      "foundAt": "2026-08-09T20:55:00Z",
      "id": "H13-014",
      "owner": "jakub-niezgoda",
      "resolution": "One monotonic deadline is propagated through Git and test discovery, bounded filesystem reads, executable/source hashing, parsing, commands, post-checks, and bounded temporary cleanup.",
      "resolvedAt": "2026-08-09T21:19:55Z",
      "severity": "P1",
      "status": "resolved",
      "summary": "The version 1.3 overall deadline did not govern closure, filesystem, hashing, parsing, discovery, and cleanup phases.",
      "targetDate": "2026-08-09",
      "targetMilestone": "G5"
    },
    {
      "foundAt": "2026-08-09T20:55:00Z",
      "id": "H13-015",
      "owner": "jakub-niezgoda",
      "resolution": "Validation now requires fixed canonical argv, exact accountable hashes for all 24 TUF and 40 non-self standards identities, and exact names and file counts for all four packages, defeating fully rebound forged receipts.",
      "resolvedAt": "2026-08-09T21:19:55Z",
      "severity": "P1",
      "status": "resolved",
      "summary": "The version 1.3 schema allowed a fresh fully rebound receipt to substitute plausible commands, test identities, and package counts.",
      "targetDate": "2026-08-09",
      "targetMilestone": "G5"
    },
    {
      "foundAt": "2026-08-09T20:55:00Z",
      "id": "H13-016",
      "owner": "jakub-niezgoda",
      "resolution": "Capture binds pre/post working metadata in addition to bytes and index state; a real child mutates and restores a tracked sentinel during guarded execution and is rejected.",
      "resolvedAt": "2026-08-09T21:19:55Z",
      "severity": "P1",